{
  "$schema": "../../../schema/units.schema.json",
  "status": "candidate",
  "evidence": { "confidence": "corroborated-implementation" },
  "fields": {
    "awbw_id": "external AWBW unit-type ID",
    "move": "base movement points",
    "movement_class": "key into movement-costs.json",
    "max_fuel": "base maximum fuel",
    "max_ammo": "base maximum ammo-weapon ammo",
    "fuel_per_turn": "normal and fuel-consuming hidden-mode upkeep",
    "indirect_range": "indirect-fire range; null for non-indirect units"
  },
  "units": {
    "infantry": {
      "awbw_id": 1,
      "domain": "ground",
      "cost": 1000,
      "move": 3,
      "movement_class": "foot",
      "max_fuel": 99,
      "max_ammo": 0,
      "fuel_per_turn": { "normal": 0, "hidden": null },
      "vision": 2,
      "indirect_range": null
    },
    "mech": {
      "awbw_id": 2,
      "domain": "ground",
      "cost": 3000,
      "move": 2,
      "movement_class": "boot",
      "max_fuel": 70,
      "max_ammo": 3,
      "fuel_per_turn": { "normal": 0, "hidden": null },
      "vision": 2,
      "indirect_range": null
    },
    "md-tank": {
      "awbw_id": 3,
      "domain": "ground",
      "cost": 16000,
      "move": 5,
      "movement_class": "treads",
      "max_fuel": 50,
      "max_ammo": 8,
      "fuel_per_turn": { "normal": 0, "hidden": null },
      "vision": 1,
      "indirect_range": null
    },
    "tank": {
      "awbw_id": 4,
      "domain": "ground",
      "cost": 7000,
      "move": 6,
      "movement_class": "treads",
      "max_fuel": 70,
      "max_ammo": 9,
      "fuel_per_turn": { "normal": 0, "hidden": null },
      "vision": 3,
      "indirect_range": null
    },
    "recon": {
      "awbw_id": 5,
      "domain": "ground",
      "cost": 4000,
      "move": 8,
      "movement_class": "tires",
      "max_fuel": 80,
      "max_ammo": 0,
      "fuel_per_turn": { "normal": 0, "hidden": null },
      "vision": 5,
      "indirect_range": null
    },
    "apc": {
      "awbw_id": 6,
      "domain": "ground",
      "cost": 5000,
      "move": 6,
      "movement_class": "treads",
      "max_fuel": 70,
      "max_ammo": 0,
      "fuel_per_turn": { "normal": 0, "hidden": null },
      "vision": 1,
      "indirect_range": null
    },
    "artillery": {
      "awbw_id": 7,
      "domain": "ground",
      "cost": 6000,
      "move": 5,
      "movement_class": "treads",
      "max_fuel": 50,
      "max_ammo": 9,
      "fuel_per_turn": { "normal": 0, "hidden": null },
      "vision": 1,
      "indirect_range": { "min": 2, "max": 3 }
    },
    "rocket": {
      "awbw_id": 8,
      "domain": "ground",
      "cost": 15000,
      "move": 5,
      "movement_class": "tires",
      "max_fuel": 50,
      "max_ammo": 6,
      "fuel_per_turn": { "normal": 0, "hidden": null },
      "vision": 1,
      "indirect_range": { "min": 3, "max": 5 }
    },
    "anti-air": {
      "awbw_id": 9,
      "domain": "ground",
      "cost": 8000,
      "move": 6,
      "movement_class": "treads",
      "max_fuel": 60,
      "max_ammo": 9,
      "fuel_per_turn": { "normal": 0, "hidden": null },
      "vision": 2,
      "indirect_range": null
    },
    "missile": {
      "awbw_id": 10,
      "domain": "ground",
      "cost": 12000,
      "move": 4,
      "movement_class": "tires",
      "max_fuel": 50,
      "max_ammo": 6,
      "fuel_per_turn": { "normal": 0, "hidden": null },
      "vision": 5,
      "indirect_range": { "min": 3, "max": 5 }
    },
    "fighter": {
      "awbw_id": 11,
      "domain": "air",
      "cost": 20000,
      "move": 9,
      "movement_class": "air",
      "max_fuel": 99,
      "max_ammo": 9,
      "fuel_per_turn": { "normal": 5, "hidden": null },
      "vision": 2,
      "indirect_range": null
    },
    "bomber": {
      "awbw_id": 12,
      "domain": "air",
      "cost": 22000,
      "move": 7,
      "movement_class": "air",
      "max_fuel": 99,
      "max_ammo": 9,
      "fuel_per_turn": { "normal": 5, "hidden": null },
      "vision": 2,
      "indirect_range": null
    },
    "b-copter": {
      "awbw_id": 13,
      "domain": "air",
      "cost": 9000,
      "move": 6,
      "movement_class": "air",
      "max_fuel": 99,
      "max_ammo": 6,
      "fuel_per_turn": { "normal": 2, "hidden": null },
      "vision": 3,
      "indirect_range": null
    },
    "t-copter": {
      "awbw_id": 14,
      "domain": "air",
      "cost": 5000,
      "move": 6,
      "movement_class": "air",
      "max_fuel": 99,
      "max_ammo": 0,
      "fuel_per_turn": { "normal": 2, "hidden": null },
      "vision": 2,
      "indirect_range": null
    },
    "battleship": {
      "awbw_id": 15,
      "domain": "sea",
      "cost": 28000,
      "move": 5,
      "movement_class": "sea",
      "max_fuel": 99,
      "max_ammo": 9,
      "fuel_per_turn": { "normal": 1, "hidden": null },
      "vision": 2,
      "indirect_range": { "min": 2, "max": 6 }
    },
    "cruiser": {
      "awbw_id": 16,
      "domain": "sea",
      "cost": 18000,
      "move": 6,
      "movement_class": "sea",
      "max_fuel": 99,
      "max_ammo": 9,
      "fuel_per_turn": { "normal": 1, "hidden": null },
      "vision": 3,
      "indirect_range": null
    },
    "lander": {
      "awbw_id": 17,
      "domain": "sea",
      "cost": 12000,
      "move": 6,
      "movement_class": "lander",
      "max_fuel": 99,
      "max_ammo": 0,
      "fuel_per_turn": { "normal": 1, "hidden": null },
      "vision": 1,
      "indirect_range": null
    },
    "sub": {
      "awbw_id": 18,
      "domain": "sea",
      "cost": 20000,
      "move": 5,
      "movement_class": "sea",
      "max_fuel": 60,
      "max_ammo": 6,
      "fuel_per_turn": { "normal": 1, "hidden": 5 },
      "vision": 5,
      "indirect_range": null
    },
    "black-boat": {
      "awbw_id": 28,
      "domain": "sea",
      "cost": 7500,
      "move": 7,
      "movement_class": "lander",
      "max_fuel": 60,
      "max_ammo": 0,
      "fuel_per_turn": { "normal": 1, "hidden": null },
      "vision": 1,
      "indirect_range": null
    },
    "carrier": {
      "awbw_id": 29,
      "domain": "sea",
      "cost": 30000,
      "move": 5,
      "movement_class": "sea",
      "max_fuel": 99,
      "max_ammo": 9,
      "fuel_per_turn": { "normal": 1, "hidden": null },
      "vision": 4,
      "indirect_range": { "min": 3, "max": 8 }
    },
    "stealth": {
      "awbw_id": 30,
      "domain": "air",
      "cost": 24000,
      "move": 6,
      "movement_class": "air",
      "max_fuel": 60,
      "max_ammo": 6,
      "fuel_per_turn": { "normal": 5, "hidden": 8 },
      "vision": 4,
      "indirect_range": null
    },
    "neo-tank": {
      "awbw_id": 46,
      "domain": "ground",
      "cost": 22000,
      "move": 6,
      "movement_class": "treads",
      "max_fuel": 99,
      "max_ammo": 9,
      "fuel_per_turn": { "normal": 0, "hidden": null },
      "vision": 1,
      "indirect_range": null
    },
    "piperunner": {
      "awbw_id": 960900,
      "domain": "ground",
      "cost": 20000,
      "move": 9,
      "movement_class": "pipe",
      "max_fuel": 99,
      "max_ammo": 9,
      "fuel_per_turn": { "normal": 0, "hidden": null },
      "vision": 4,
      "indirect_range": { "min": 2, "max": 5 }
    },
    "black-bomb": {
      "awbw_id": 968731,
      "domain": "air",
      "cost": 25000,
      "move": 9,
      "movement_class": "air",
      "max_fuel": 45,
      "max_ammo": 0,
      "fuel_per_turn": { "normal": 5, "hidden": null },
      "vision": 1,
      "indirect_range": null
    },
    "mega-tank": {
      "awbw_id": 1141438,
      "domain": "ground",
      "cost": 28000,
      "move": 4,
      "movement_class": "treads",
      "max_fuel": 50,
      "max_ammo": 3,
      "fuel_per_turn": { "normal": 0, "hidden": null },
      "vision": 1,
      "indirect_range": null
    }
  }
}
